{"$schema":"../schemas/nidl/0.1/implementation.schema.json","capabilities":{"CONGESTION_CONTROL":true,"LOCATOR_MIGRATION":true,"MESSAGE_BOUNDARIES":true,"ORDERED_DELIVERY":"per-stream","RELIABLE_DELIVERY":true,"UNRELIABLE_DATAGRAM":true},"implementation":{"id":"NOVA-BINDING-IPV4-QUIC","status":"stub","version":"0.1.0"},"implements":[{"interface":"NOVA-IF-P-RAP-BINDING","version":"0.1.0"}],"nidl":"0.1","technology":{"network":"IPv4","transport":"QUIC over UDP"}}
