{"$schema":"../schemas/nidl/0.1/implementation.schema.json","capabilities":{"BROADCAST":true,"CONGESTION_SIGNAL":false,"MULTICAST":true,"POINT_TO_POINT":false},"implementation":{"id":"NOVA-ADAPTER-ETHERNET","status":"stub","version":"0.1.0"},"implements":[{"interface":"NOVA-IF-P-LAP-ADAPTER","version":"0.1.0"}],"nidl":"0.1","technology":{"kind":"Ethernet","nexus":"IEEE 802.3"}}
