{"$schema":"../schemas/nidl/0.1/implementation.schema.json","capabilities":{"ADVERSARIAL_PROVIDER_MODE":false,"IDENTITY_UPDATE_CONTROL":true,"LOOPBACK_DIAGNOSTIC_MODE":false,"OBFUSCATED_DEGREE_CONTROL":true,"PAIRED_NODE_MODE":true,"RECORD_REPLAY":false,"VIRTUAL_FABRIC_MODE":"partial"},"implementation":{"id":"NOVA-P-0AP","status":"stub","version":"0.1.0"},"implements":[{"interface":"NOVA-IF-P-PATH-PROVIDER","version":"0.3.0"},{"interface":"NOVA-IF-P-0AP-CONTROL","version":"0.2.0"}],"nidl":"0.1","technology":{"component":"P-0AP","underlay":"none"}}
