{"$schema":"../schemas/nidl/0.1/implementation.schema.json","capabilities":{"CONGESTION_CONTROL":"profile-dependent","LOCATOR_MIGRATION":true,"MESSAGE_BOUNDARIES":true,"ORDERED_DELIVERY":"profile-dependent","RELIABLE_DELIVERY":"profile-dependent","UNRELIABLE_DATAGRAM":true},"implementation":{"id":"NOVA-BINDING-SIMULATED","status":"stub","version":"0.1.0"},"implements":[{"interface":"NOVA-IF-P-RAP-BINDING","version":"0.1.0"}],"nidl":"0.1","technology":{"network":"Simulated routed underlay","transport":"Configurable Virtual Fabric profile"}}
