{"$schema":"../schemas/nidl/0.1/implementation.schema.json","capabilities":{"BIDIRECTIONAL_LINKS":true,"DIRECTIONAL_LINKS":true,"FAULT_INJECTION":true,"RECORD_REPLAY":true,"SEEDED_RANDOM":true,"VIRTUAL_CLOCK":true},"implementation":{"id":"NOVA-VIRTUAL-FABRIC","status":"stub","version":"0.1.0"},"implements":[{"interface":"NOVA-IF-VIRTUAL-FABRIC","version":"0.1.0"}],"nidl":"0.1","technology":{"component":"Deterministic in-process simulation engine"}}
