{"$schema":"../schemas/nidl/0.1/implementation.schema.json","capabilities":{"declared":false},"implementation":{"id":"NOVA-IP-PLATFORM-WINDOWS-NDIS","status":"stub","version":"0.1.0"},"implements":[{"interface":"NOVA-IF-IP-PLATFORM-ATTACHMENT","version":"0.1.0"}],"nidl":"0.1","technology":{"os":"Windows","technology":"NDIS or approved L3 virtual interface mechanism"}}
