{"$schema":"../schemas/nidl/0.1/implementation.schema.json","capabilities":{"BROADCAST":true,"CONGESTION_SIGNAL":true,"MULTICAST":true,"POINT_TO_POINT":true},"implementation":{"id":"NOVA-ADAPTER-SIMULATED","status":"stub","version":"0.1.0"},"implements":[{"interface":"NOVA-IF-P-LAP-ADAPTER","version":"0.1.0"}],"nidl":"0.1","technology":{"engine":"NOVA-VIRTUAL-FABRIC","kind":"Simulated Nexus Fundamenta"}}
